ID_Pregunta,Pregunta,Opcion_A,Opcion_B,Opcion_C,Opcion_Correcta,Comentario_A,Comentario_B,Comentario_C,Comentario_Correcta,Estado,ID_Video,ID_Area,ID_Tema
PREG039, Caso: Para fabricar un soporte metálico un alumno genera un código G a partir del modelo 3D creado. ¿Qué tecnología está aplicando?, CAE, CAD, no  aplica, CAM,Incorrecto.  CAE no es la mejor opción para resolver el caso descrito. Revisa las características de  cae y su aplicación práctica.,Incorrecto.  CAD no es la mejor opción para resolver el caso descrito. Revisa las características de  cad y su aplicación práctica.,Incorrecto.  no  aplica no es la mejor opción para resolver el caso descrito. Revisa las características de  no  aplica y su aplicación práctica.,"Correcto.  CAM es la elección adecuada porque cumple con las necesidades mecánicas del escenario presentado, garantizando un funcionamiento eficiente y seguro.",Activo, no aplica,AR2C2,TEM05
PREG040, Caso: Un equipo de estudiantes realiza un análisis de esfuerzos sobre una estructura de aluminio diseñada para soportar un motor. ¿Qué tipo de tecnología están usando?, CAM, CAD, no aplica, CAE,Incorrecto.  CAM no es la mejor opción para resolver el caso descrito. Revisa las características de  cam y su aplicación práctica.,Incorrecto.  CAD no es la mejor opción para resolver el caso descrito. Revisa las características de  cad y su aplicación práctica.,Incorrecto.  no aplica no es la mejor opción para resolver el caso descrito. Revisa las características de  no aplica y su aplicación práctica.,"Correcto.  CAE es la elección adecuada porque cumple con las necesidades mecánicas del escenario presentado, garantizando un funcionamiento eficiente y seguro.",Activo, no aplica,AR2C2,TEM05
PREG041, Caso: El docente pide simular una carga puntual sobre una placa metálica en Autodesk Inventor para verificar su resistencia. ¿Qué resultado espera el alumno del análisis CAE?, Visualización de trayectorias de herramienta, Códigos de programación en G para torno , no aplica, Mapa de esfuerzos y desplazamientos en la placa,Incorrecto.  Visualización de trayectorias de herramienta no es la mejor opción para resolver el caso descrito. Revisa las características de  visualización de trayectorias de herramienta y su aplicación práctica.,Incorrecto.  Códigos de programación en G para torno  no es la mejor opción para resolver el caso descrito. Revisa las características de  códigos de programación en g para torno  y su aplicación práctica.,Incorrecto.  no aplica no es la mejor opción para resolver el caso descrito. Revisa las características de  no aplica y su aplicación práctica.,"Correcto.  Mapa de esfuerzos y desplazamientos en la placa es la elección adecuada porque cumple con las necesidades mecánicas del escenario presentado, garantizando un funcionamiento eficiente y seguro.",Activo, no aplica,AR2C2,TEM05
PREG042, Caso: Para verificar la eficiencia del diseño de un sistema de ventilación un estudiante realiza un análisis de flujo de aire. ¿Qué tipo de análisis está realizando?, Analisis estructural, Simulacion termica, no aplica, Analisis CFD,Incorrecto.  Analisis estructural no es la mejor opción para resolver el caso descrito. Revisa las características de  analisis estructural y su aplicación práctica.,Incorrecto.  Simulacion termica no es la mejor opción para resolver el caso descrito. Revisa las características de  simulacion termica y su aplicación práctica.,Incorrecto.  no aplica no es la mejor opción para resolver el caso descrito. Revisa las características de  no aplica y su aplicación práctica.,"Correcto.  Analisis CFD es la elección adecuada porque cumple con las necesidades mecánicas del escenario presentado, garantizando un funcionamiento eficiente y seguro.",Activo, no aplica,AR2C2,TEM05
PREG043, Caso: Un estudiante genera los planos técnicos de un componente en AutoCAD y los entrega al taller para su manufactura. ¿Qué característica debe tener el diseño para garantizar la producción correcta?, Incluir simbologia electronica, Incluir codigo fuente de programacion, no aplica, Definir cotastolerancias y materiales en el plano,Incorrecto.  Incluir simbologia electronica no es la mejor opción para resolver el caso descrito. Revisa las características de  incluir simbologia electronica y su aplicación práctica.,Incorrecto.  Incluir codigo fuente de programacion no es la mejor opción para resolver el caso descrito. Revisa las características de  incluir codigo fuente de programacion y su aplicación práctica.,Incorrecto.  no aplica no es la mejor opción para resolver el caso descrito. Revisa las características de  no aplica y su aplicación práctica.,"Correcto.  Definir cotastolerancias y materiales en el plano es la elección adecuada porque cumple con las necesidades mecánicas del escenario presentado, garantizando un funcionamiento eficiente y seguro.",Activo, no aplica,AR2C2,TEM05
PREG044, Caso: Durante la manufactura con torno CNC un estudiante nota que el componente fabricado no coincide con el modelo CAD. ¿Cuál podría ser la causa del error?, Mala conexion del sensor al PLC, Baja resolucion del modelo CAD, no aplica, Error en la programacion del CAM,Incorrecto.  Mala conexion del sensor al PLC no es la mejor opción para resolver el caso descrito. Revisa las características de  mala conexion del sensor al plc y su aplicación práctica.,Incorrecto.  Baja resolucion del modelo CAD no es la mejor opción para resolver el caso descrito. Revisa las características de  baja resolucion del modelo cad y su aplicación práctica.,Incorrecto.  no aplica no es la mejor opción para resolver el caso descrito. Revisa las características de  no aplica y su aplicación práctica.,"Correcto.  Error en la programacion del CAM es la elección adecuada porque cumple con las necesidades mecánicas del escenario presentado, garantizando un funcionamiento eficiente y seguro.",Activo, no aplica,AR2C2,TEM05
PREG045, Caso: Un alumno decide probar varios materiales virtuales en el análisis de un eje para elegir el más resistente al esfuerzo torsional. ¿Qué ventaja ofrece esta simulación en CAE?,  Reducción del tiempo de dibujo,Garante el éxito del diseño en condiciones reales,no aplica, Permite predecir el comportamiento del componente sin fabricarlo,Incorrecto.   Reducción del tiempo de dibujo no es la mejor opción para resolver el caso descrito. Revisa las características de   reducción del tiempo de dibujo y su aplicación práctica.,Incorrecto. Garante el éxito del diseño en condiciones reales no es la mejor opción para resolver el caso descrito. Revisa las características de garante el éxito del diseño en condiciones reales y su aplicación práctica.,Esta opción no aplica en el contexto del caso descrito.,"Correcto.  Permite predecir el comportamiento del componente sin fabricarlo es la elección adecuada porque cumple con las necesidades mecánicas del escenario presentado, garantizando un funcionamiento eficiente y seguro.",Activo, no aplica,AR2C2,TEM05
PREG046, Caso: Un equipo utiliza CAM para generar el código de trayectorias de corte para una fresadora CNC. ¿Qué elementos debe contener este código?, Coordenadas de origen del modelo 3D , Resultados del análisis modal, no aplica, Trayectorias velocidades y profundidades de corte,Incorrecto.  Coordenadas de origen del modelo 3D  no es la mejor opción para resolver el caso descrito. Revisa las características de  coordenadas de origen del modelo 3d  y su aplicación práctica.,Incorrecto.  Resultados del análisis modal no es la mejor opción para resolver el caso descrito. Revisa las características de  resultados del análisis modal y su aplicación práctica.,Incorrecto.  no aplica no es la mejor opción para resolver el caso descrito. Revisa las características de  no aplica y su aplicación práctica.,"Correcto.  Trayectorias velocidades y profundidades de corte es la elección adecuada porque cumple con las necesidades mecánicas del escenario presentado, garantizando un funcionamiento eficiente y seguro.",Activo, no apica,AR2C2,TEM05
PREG047, Caso: Se solicita a los alumnos simular una prueba de carga sobre una estructura de soporte hecha con impresión 3D antes de producirla. ¿Qué permite evitar esta práctica?, Cambiar el diseño sin consultarlo con el cliente,Generar automáticamente planos eléctricos , no aplica, Realizar iteraciones virtuales para reducir errores de diseño,Incorrecto.  Cambiar el diseño sin consultarlo con el cliente no es la mejor opción para resolver el caso descrito. Revisa las características de  cambiar el diseño sin consultarlo con el cliente y su aplicación práctica.,Incorrecto. Generar automáticamente planos eléctricos  no es la mejor opción para resolver el caso descrito. Revisa las características de generar automáticamente planos eléctricos  y su aplicación práctica.,Incorrecto.  no aplica no es la mejor opción para resolver el caso descrito. Revisa las características de  no aplica y su aplicación práctica.,"Correcto.  Realizar iteraciones virtuales para reducir errores de diseño es la elección adecuada porque cumple con las necesidades mecánicas del escenario presentado, garantizando un funcionamiento eficiente y seguro.",Activo, no aplica,AR2C2,TEM05
PREG048, Caso: Un estudiante utiliza un sensor de efecto Hall para medir la velocidad de rotación de un motor DC. ¿Por qué es adecuado este sensor para la aplicación?, Detecta la distancia entre dos superficies,Mide directamente el par del motor , no aplica, Es capaz de detectar campos magnéticos generados por imanes giratorios,Incorrecto.  Detecta la distancia entre dos superficies no es la mejor opción para resolver el caso descrito. Revisa las características de  detecta la distancia entre dos superficies y su aplicación práctica.,Incorrecto. Mide directamente el par del motor  no es la mejor opción para resolver el caso descrito. Revisa las características de mide directamente el par del motor  y su aplicación práctica.,Incorrecto.  no aplica no es la mejor opción para resolver el caso descrito. Revisa las características de  no aplica y su aplicación práctica.,"Correcto.  Es capaz de detectar campos magnéticos generados por imanes giratorios es la elección adecuada porque cumple con las necesidades mecánicas del escenario presentado, garantizando un funcionamiento eficiente y seguro.",Activo, no aplica,AR2C2,TEM06
PREG049, Caso: Se desea detectar la presencia de un objeto metálico en una línea de producción. ¿Qué tipo de sensor es más recomendable? , Sensor capacitivo, Sensor fotoelectrico difuso, no aplica, Sensor inductivo,Incorrecto.  Sensor capacitivo no es la mejor opción para resolver el caso descrito. Revisa las características de  sensor capacitivo y su aplicación práctica.,Incorrecto.  Sensor fotoelectrico difuso no es la mejor opción para resolver el caso descrito. Revisa las características de  sensor fotoelectrico difuso y su aplicación práctica.,Incorrecto.  no aplica no es la mejor opción para resolver el caso descrito. Revisa las características de  no aplica y su aplicación práctica.,"Correcto.  Sensor inductivo es la elección adecuada porque cumple con las necesidades mecánicas del escenario presentado, garantizando un funcionamiento eficiente y seguro.",Activo, no aplica,AR2C2,TEM06
PREG050, Caso: Un alumno conecta un servomotor a una tarjeta de control y programa su posición angular. ¿Qué característica distingue al servomotor en esta aplicación?,  Movimiento continuo sin control de posición, Capacidad de girar indefinidamente sin retroalimentación, no aplica, Control preciso de posición mediante retroalimentación interna,Incorrecto.   Movimiento continuo sin control de posición no es la mejor opción para resolver el caso descrito. Revisa las características de   movimiento continuo sin control de posición y su aplicación práctica.,Incorrecto.  Capacidad de girar indefinidamente sin retroalimentación no es la mejor opción para resolver el caso descrito. Revisa las características de  capacidad de girar indefinidamente sin retroalimentación y su aplicación práctica.,Incorrecto.  no aplica no es la mejor opción para resolver el caso descrito. Revisa las características de  no aplica y su aplicación práctica.,"Correcto.  Control preciso de posición mediante retroalimentación interna es la elección adecuada porque cumple con las necesidades mecánicas del escenario presentado, garantizando un funcionamiento eficiente y seguro.",Activo, no apica,AR2C2,TEM06
PREG051, Caso: Se requiere controlar la apertura de una válvula proporcional de flujo de agua en un sistema de riego automatizado. ¿Qué tipo de actuador es el más adecuado?, Actuador neumático de doble efecto, Solenoide on/off, no aplica, Actuador eléctrico proporcional,Incorrecto.  Actuador neumático de doble efecto no es la mejor opción para resolver el caso descrito. Revisa las características de  actuador neumático de doble efecto y su aplicación práctica.,Incorrecto.  Solenoide on/off no es la mejor opción para resolver el caso descrito. Revisa las características de  solenoide on/off y su aplicación práctica.,Incorrecto.  no aplica no es la mejor opción para resolver el caso descrito. Revisa las características de  no aplica y su aplicación práctica.,"Correcto.  Actuador eléctrico proporcional es la elección adecuada porque cumple con las necesidades mecánicas del escenario presentado, garantizando un funcionamiento eficiente y seguro.",Activo, no aplica,AR2C2,TEM06
PREG052, Caso: El estudiante necesita detectar el nivel de agua en un depósito con alta precisión. ¿Qué tipo de sensor sería más adecuado?, Sensor inductivo, Sensor de temperatura, no aplica, Sensor de ultrasonido,Incorrecto.  Sensor inductivo no es la mejor opción para resolver el caso descrito. Revisa las características de  sensor inductivo y su aplicación práctica.,Incorrecto.  Sensor de temperatura no es la mejor opción para resolver el caso descrito. Revisa las características de  sensor de temperatura y su aplicación práctica.,Incorrecto.  no aplica no es la mejor opción para resolver el caso descrito. Revisa las características de  no aplica y su aplicación práctica.,"Correcto.  Sensor de ultrasonido es la elección adecuada porque cumple con las necesidades mecánicas del escenario presentado, garantizando un funcionamiento eficiente y seguro.",Activo, no aplica,AR2C2,TEM06
PREG053, Caso: Un prototipo de robot móvil usa sensores infrarrojos para evitar colisiones. ¿Qué limitación tienen estos sensores?,Alta inmunidad al ruido óptico, Bajo costo y buen rendimiento a larga distancia, no aplica,  Precisión limitada en ambientes muy iluminados o con superficies oscuras,Incorrecto. Alta inmunidad al ruido óptico no es la mejor opción para resolver el caso descrito. Revisa las características de alta inmunidad al ruido óptico y su aplicación práctica.,Incorrecto.  Bajo costo y buen rendimiento a larga distancia no es la mejor opción para resolver el caso descrito. Revisa las características de  bajo costo y buen rendimiento a larga distancia y su aplicación práctica.,Incorrecto.  no aplica no es la mejor opción para resolver el caso descrito. Revisa las características de  no aplica y su aplicación práctica.,"Correcto.   Precisión limitada en ambientes muy iluminados o con superficies oscuras es la elección adecuada porque cumple con las necesidades mecánicas del escenario presentado, garantizando un funcionamiento eficiente y seguro.",Activo, no aplica,AR2C2,TEM06
PREG054, Caso: Un estudiante conecta un sensor de fuerza (FSR) para activar una alarma cuando se aplique presión.  ¿Qué tipo de señal entrega este sensor?, Señal binaria 0 o 1,  Señal digital PWM, no aplica,  Señal análoga proporcional a la presión,Incorrecto.  Señal binaria 0 o 1 no es la mejor opción para resolver el caso descrito. Revisa las características de  señal binaria 0 o 1 y su aplicación práctica.,Incorrecto.   Señal digital PWM no es la mejor opción para resolver el caso descrito. Revisa las características de   señal digital pwm y su aplicación práctica.,Incorrecto.  no aplica no es la mejor opción para resolver el caso descrito. Revisa las características de  no aplica y su aplicación práctica.,"Correcto.   Señal análoga proporcional a la presión es la elección adecuada porque cumple con las necesidades mecánicas del escenario presentado, garantizando un funcionamiento eficiente y seguro.",Activo, no aplica,AR2C2,TEM06
PREG055, Caso: Se implementa un encoder óptico en el eje de un motor. ¿Cuál es la función principal del encoder en este contexto?, Controlar la velocidad mediante variación de voltaje, Medir la temperatura del motor, no aplica, Proporcionar información sobre la posición y velocidad del eje,Incorrecto.  Controlar la velocidad mediante variación de voltaje no es la mejor opción para resolver el caso descrito. Revisa las características de  controlar la velocidad mediante variación de voltaje y su aplicación práctica.,Incorrecto.  Medir la temperatura del motor no es la mejor opción para resolver el caso descrito. Revisa las características de  medir la temperatura del motor y su aplicación práctica.,Incorrecto.  no aplica no es la mejor opción para resolver el caso descrito. Revisa las características de  no aplica y su aplicación práctica.,"Correcto.  Proporcionar información sobre la posición y velocidad del eje es la elección adecuada porque cumple con las necesidades mecánicas del escenario presentado, garantizando un funcionamiento eficiente y seguro.",Activo, no aplica,AR2C2,TEM06
PREG056, Caso: Para accionar una compuerta industrial se selecciona un actuador neumático con control por válvula solenoide. ¿Qué ventaja ofrece este tipo de actuador?, Alta precisión de posicionamiento, Control proporcional mediante señales PWM, no aplica,  Fuerza considerable y rapidez en la respuesta,Incorrecto.  Alta precisión de posicionamiento no es la mejor opción para resolver el caso descrito. Revisa las características de  alta precisión de posicionamiento y su aplicación práctica.,Incorrecto.  Control proporcional mediante señales PWM no es la mejor opción para resolver el caso descrito. Revisa las características de  control proporcional mediante señales pwm y su aplicación práctica.,Incorrecto.  no aplica no es la mejor opción para resolver el caso descrito. Revisa las características de  no aplica y su aplicación práctica.,"Correcto.   Fuerza considerable y rapidez en la respuesta es la elección adecuada porque cumple con las necesidades mecánicas del escenario presentado, garantizando un funcionamiento eficiente y seguro.",Activo, no aplica,AR2C2,TEM06
PREG057, Caso: Un estudiante diseña un sistema que detecta el paso de piezas en una banda transportadora y activa un pistón neumático para separar defectuosos. ¿Qué combinación de sensor y actuador es más adecuada?, Sensor capacitivo y motor paso a paso, Sensor de proximidad inductivo y servomotor, no aplica,  Sensor fotoeléctrico y actuador neumático,Incorrecto.  Sensor capacitivo y motor paso a paso no es la mejor opción para resolver el caso descrito. Revisa las características de  sensor capacitivo y motor paso a paso y su aplicación práctica.,Incorrecto.  Sensor de proximidad inductivo y servomotor no es la mejor opción para resolver el caso descrito. Revisa las características de  sensor de proximidad inductivo y servomotor y su aplicación práctica.,Incorrecto.  no aplica no es la mejor opción para resolver el caso descrito. Revisa las características de  no aplica y su aplicación práctica.,"Correcto.   Sensor fotoeléctrico y actuador neumático es la elección adecuada porque cumple con las necesidades mecánicas del escenario presentado, garantizando un funcionamiento eficiente y seguro.",Activo, no aplica,AR2C2,TEM06
PREG058, Caso: En un banco de pruebas un alumno debe registrar la variación de temperatura en tiempo real durante el funcionamiento de un motor. ¿Qué componente es necesario para transformar la señal del sensor a un formato que pueda ser digitalizado?, Amplificador operacional, DAC (convertidor digital a analógico), no aplica, Acondicionador de señal,Incorrecto.  Amplificador operacional no es la mejor opción para resolver el caso descrito. Revisa las características de  amplificador operacional y su aplicación práctica.,Incorrecto.  DAC (convertidor digital a analógico) no es la mejor opción para resolver el caso descrito. Revisa las características de  dac (convertidor digital a analógico) y su aplicación práctica.,Incorrecto.  no aplica no es la mejor opción para resolver el caso descrito. Revisa las características de  no aplica y su aplicación práctica.,"Correcto.  Acondicionador de señal es la elección adecuada porque cumple con las necesidades mecánicas del escenario presentado, garantizando un funcionamiento eficiente y seguro.",Activo, no aplica,AR2C2,TEM07
PREG059, Caso: Un sistema de monitoreo de vibraciones requiere registrar datos a frecuencias superiores a 5 kHz. ¿Qué parámetro del sistema de adquisición debe considerarse?, Resolución de 8 bits,Tipo de sensor utilizado,no aplica,Frecuencia de muestreo del ADC,Incorrecto.  Resolución de 8 bits no es la mejor opción para resolver el caso descrito. Revisa las características de  resolución de 8 bits y su aplicación práctica.,Incorrecto. Tipo de sensor utilizado no es la mejor opción para resolver el caso descrito. Revisa las características de tipo de sensor utilizado y su aplicación práctica.,Esta opción no aplica en el contexto del caso descrito.,"Correcto. Frecuencia de muestreo del ADC es la elección adecuada porque cumple con las necesidades mecánicas del escenario presentado, garantizando un funcionamiento eficiente y seguro.",Activo, no aplica,AR2C2,TEM07
PREG060, Caso: Un estudiante utiliza una tarjeta DAQ para registrar señales de presión temperatura y velocidad en un sistema hidráulico. ¿Qué función cumple el software de adquisición de datos?, Convierte señales analógicas a digitales, Aumenta la resolución del sensor, no aplica,  Almacena visualiza y analiza las señales adquiridas,Incorrecto.  Convierte señales analógicas a digitales no es la mejor opción para resolver el caso descrito. Revisa las características de  convierte señales analógicas a digitales y su aplicación práctica.,Incorrecto.  Aumenta la resolución del sensor no es la mejor opción para resolver el caso descrito. Revisa las características de  aumenta la resolución del sensor y su aplicación práctica.,Incorrecto.  no aplica no es la mejor opción para resolver el caso descrito. Revisa las características de  no aplica y su aplicación práctica.,"Correcto.   Almacena visualiza y analiza las señales adquiridas es la elección adecuada porque cumple con las necesidades mecánicas del escenario presentado, garantizando un funcionamiento eficiente y seguro.",Activo, no aplica,AR2C2,TEM07
PREG061, Caso: En un laboratorio un alumno conecta una celda de carga a un sistema DAQ pero los valores registrados son erráticos. ¿Qué puede estar causando este comportamiento?, Uso de un sensor digital en lugar de uno analógico, Baja velocidad de muestreo, no aplica, Falta de un amplificador de instrumentación,Incorrecto.  Uso de un sensor digital en lugar de uno analógico no es la mejor opción para resolver el caso descrito. Revisa las características de  uso de un sensor digital en lugar de uno analógico y su aplicación práctica.,Incorrecto.  Baja velocidad de muestreo no es la mejor opción para resolver el caso descrito. Revisa las características de  baja velocidad de muestreo y su aplicación práctica.,Incorrecto.  no aplica no es la mejor opción para resolver el caso descrito. Revisa las características de  no aplica y su aplicación práctica.,"Correcto.  Falta de un amplificador de instrumentación es la elección adecuada porque cumple con las necesidades mecánicas del escenario presentado, garantizando un funcionamiento eficiente y seguro.",Activo, no aplica,AR2C2,TEM07
PREG062, Caso: Se desea registrar la posición de un eje giratorio a través de un potenciómetro. ¿Qué tipo de señal entrega este sensor al sistema de adquisición?,Señal digital codificada, Pulso cuadrado de frecuencia variable,no aplica,Señal de voltaje variable proporcional a la posición,Incorrecto. Señal digital codificada no es la mejor opción para resolver el caso descrito. Revisa las características de señal digital codificada y su aplicación práctica.,Incorrecto.  Pulso cuadrado de frecuencia variable no es la mejor opción para resolver el caso descrito. Revisa las características de  pulso cuadrado de frecuencia variable y su aplicación práctica.,Esta opción no aplica en el contexto del caso descrito.,"Correcto. Señal de voltaje variable proporcional a la posición es la elección adecuada porque cumple con las necesidades mecánicas del escenario presentado, garantizando un funcionamiento eficiente y seguro.",Activo, no aplica,AR2C2,TEM07
