ID_Pregunta,Pregunta,Opcion_A,Opcion_B,Opcion_C,Opcion_Correcta,Comentario_A,Comentario_B,Comentario_C,Comentario_Correcta,Estado,ID_Video,ID_Area,ID_Tema
PREG079, Caso: El equipo necesita justificar la viabilidad económica de su proyecto de automatización. ¿Qué análisis es indispensable en esta etapa?, Simulación de fallas en los sensores, Estimacion de costos y retorno de inversion, no aplica, Analisis de riesgos tecnicos,Incorrecto.  Simulación de fallas en los sensores no es la mejor opción para resolver el caso descrito. Revisa las características de  simulación de fallas en los sensores y su aplicación práctica.,Incorrecto.  Estimacion de costos y retorno de inversion no es la mejor opción para resolver el caso descrito. Revisa las características de  estimacion de costos y retorno de inversion y su aplicación práctica.,Incorrecto.  no aplica no es la mejor opción para resolver el caso descrito. Revisa las características de  no aplica y su aplicación práctica.,"Correcto.  Analisis de riesgos tecnicos es la elección adecuada porque cumple con las necesidades mecánicas del escenario presentado, garantizando un funcionamiento eficiente y seguro.",Activo, no aplica,AR3C2,TEM09
PREG080, Caso: Un proyecto incluye sensores actuadores controladores y piezas mecánicas. ¿Qué tipo de enfoque debe aplicarse para planear correctamente su implementación?, Enfoque monodisciplinario,   Enfoque electrónico centrado, no aplica, Enfoque mecatrónico interdisciplinario,Incorrecto.  Enfoque monodisciplinario no es la mejor opción para resolver el caso descrito. Revisa las características de  enfoque monodisciplinario y su aplicación práctica.,Incorrecto.    Enfoque electrónico centrado no es la mejor opción para resolver el caso descrito. Revisa las características de    enfoque electrónico centrado y su aplicación práctica.,Incorrecto.  no aplica no es la mejor opción para resolver el caso descrito. Revisa las características de  no aplica y su aplicación práctica.,"Correcto.  Enfoque mecatrónico interdisciplinario es la elección adecuada porque cumple con las necesidades mecánicas del escenario presentado, garantizando un funcionamiento eficiente y seguro.",Activo, no aplica,AR3C2,TEM09
PREG081, Caso: En una revisión intermedia se identifica un desfase de una semana en el desarrollo del prototipo. ¿Qué técnica debe aplicarse para ajustar las actividades pendientes?, Revision de tolerancia geometrica,   Sustitución del controlador lógico programable (PLC), no aplica,  Reprogramación de actividades con ruta crítica,Incorrecto.  Revision de tolerancia geometrica no es la mejor opción para resolver el caso descrito. Revisa las características de  revision de tolerancia geometrica y su aplicación práctica.,Incorrecto.    Sustitución del controlador lógico programable (PLC) no es la mejor opción para resolver el caso descrito. Revisa las características de    sustitución del controlador lógico programable (plc) y su aplicación práctica.,Incorrecto.  no aplica no es la mejor opción para resolver el caso descrito. Revisa las características de  no aplica y su aplicación práctica.,"Correcto.   Reprogramación de actividades con ruta crítica es la elección adecuada porque cumple con las necesidades mecánicas del escenario presentado, garantizando un funcionamiento eficiente y seguro.",Activo, no aplica,AR3C2,TEM09
PREG082, Caso: Un proyecto debe completarse en 3 semanas pero las estimaciones de trabajo suman 25 días hábiles. ¿Qué estrategia de planeación puede aplicarse?,  Reemplazar sensores digitales por analógicos, Eliminar pruebas funcionales, no aplica,  Aumentar recursos y paralelizar actividades,Incorrecto.   Reemplazar sensores digitales por analógicos no es la mejor opción para resolver el caso descrito. Revisa las características de   reemplazar sensores digitales por analógicos y su aplicación práctica.,Incorrecto.  Eliminar pruebas funcionales no es la mejor opción para resolver el caso descrito. Revisa las características de  eliminar pruebas funcionales y su aplicación práctica.,Incorrecto.  no aplica no es la mejor opción para resolver el caso descrito. Revisa las características de  no aplica y su aplicación práctica.,"Correcto.   Aumentar recursos y paralelizar actividades es la elección adecuada porque cumple con las necesidades mecánicas del escenario presentado, garantizando un funcionamiento eficiente y seguro.",Activo, no aplica,AR3C2,TEM09
PREG083, Caso: Durante la fase de integración el sistema no responde como se esperaba. ¿Qué método de evaluación del proyecto debe aplicarse?, Aplicación de protocolo I2C, Analisis de densidad de corriente, no aplica, Análisis causa-efecto (Ishikawa),Incorrecto.  Aplicación de protocolo I2C no es la mejor opción para resolver el caso descrito. Revisa las características de  aplicación de protocolo i2c y su aplicación práctica.,Incorrecto.  Analisis de densidad de corriente no es la mejor opción para resolver el caso descrito. Revisa las características de  analisis de densidad de corriente y su aplicación práctica.,Incorrecto.  no aplica no es la mejor opción para resolver el caso descrito. Revisa las características de  no aplica y su aplicación práctica.,"Correcto.  Análisis causa-efecto (Ishikawa) es la elección adecuada porque cumple con las necesidades mecánicas del escenario presentado, garantizando un funcionamiento eficiente y seguro.",Activo, no aplica,AR3C2,TEM09
PREG084, Caso: Se presentan discrepancias entre el presupuesto inicial y el gasto real del proyecto. ¿Qué herramienta es útil para analizar esta situación?, Tabla de asignación de pines, Matriz de Karnaugh, no aplica, Curva S de costos acumulados,Incorrecto.  Tabla de asignación de pines no es la mejor opción para resolver el caso descrito. Revisa las características de  tabla de asignación de pines y su aplicación práctica.,Incorrecto.  Matriz de Karnaugh no es la mejor opción para resolver el caso descrito. Revisa las características de  matriz de karnaugh y su aplicación práctica.,Incorrecto.  no aplica no es la mejor opción para resolver el caso descrito. Revisa las características de  no aplica y su aplicación práctica.,"Correcto.  Curva S de costos acumulados es la elección adecuada porque cumple con las necesidades mecánicas del escenario presentado, garantizando un funcionamiento eficiente y seguro.",Activo, no aplica,AR3C2,TEM09
PREG085, Caso: Un estudiante propone modificar el diseño del proyecto para reducir costos pero afecta la calidad. ¿Qué análisis debe hacerse antes de aceptar la propuesta?,  Análisis térmico del sistema, Verificación de resistencias, no aplica, Análisis costo-beneficio,Incorrecto.   Análisis térmico del sistema no es la mejor opción para resolver el caso descrito. Revisa las características de   análisis térmico del sistema y su aplicación práctica.,Incorrecto.  Verificación de resistencias no es la mejor opción para resolver el caso descrito. Revisa las características de  verificación de resistencias y su aplicación práctica.,Incorrecto.  no aplica no es la mejor opción para resolver el caso descrito. Revisa las características de  no aplica y su aplicación práctica.,"Correcto.  Análisis costo-beneficio es la elección adecuada porque cumple con las necesidades mecánicas del escenario presentado, garantizando un funcionamiento eficiente y seguro.",Activo, no aplica,AR3C2,TEM09
PREG086, Caso: El equipo decide aplicar una metodología ágil al desarrollo del sistema. ¿Qué ventaja representa esta decisión?, Permite mayor control sobre costos fijos, Obliga a definir todos los requisitos desde el inicio, no aplica,Facilita la adaptación a cambios durante el desarrollo,Incorrecto.  Permite mayor control sobre costos fijos no es la mejor opción para resolver el caso descrito. Revisa las características de  permite mayor control sobre costos fijos y su aplicación práctica.,Incorrecto.  Obliga a definir todos los requisitos desde el inicio no es la mejor opción para resolver el caso descrito. Revisa las características de  obliga a definir todos los requisitos desde el inicio y su aplicación práctica.,Incorrecto.  no aplica no es la mejor opción para resolver el caso descrito. Revisa las características de  no aplica y su aplicación práctica.,"Correcto. Facilita la adaptación a cambios durante el desarrollo es la elección adecuada porque cumple con las necesidades mecánicas del escenario presentado, garantizando un funcionamiento eficiente y seguro.",Activo, no aplica,AR3C2,TEM09
PREG087, Caso: El equipo debe presentar el cierre del proyecto ante el comité académico. ¿Qué elementos deben incluir en su informe de evaluación final? ,Códigos fuente y diagramas eléctricos,Manual de usuario del sistema, no aplica,  Cronograma actualizado costos finales resultados y lecciones aprendidas,Incorrecto. Códigos fuente y diagramas eléctricos no es la mejor opción para resolver el caso descrito. Revisa las características de códigos fuente y diagramas eléctricos y su aplicación práctica.,Incorrecto. Manual de usuario del sistema no es la mejor opción para resolver el caso descrito. Revisa las características de manual de usuario del sistema y su aplicación práctica.,Incorrecto.  no aplica no es la mejor opción para resolver el caso descrito. Revisa las características de  no aplica y su aplicación práctica.,"Correcto.   Cronograma actualizado costos finales resultados y lecciones aprendidas es la elección adecuada porque cumple con las necesidades mecánicas del escenario presentado, garantizando un funcionamiento eficiente y seguro.",Activo, no aplica,AR3C2,TEM09
PREG088, Caso: En un proyecto mecatrónico se requiere que varios controladores lógicos programables (PLC) se comuniquen para coordinar una línea de producción. ¿Qué tipo de red industrial es la más adecuada para esta comunicación?, Red Wi-Fi doméstica,Red Bluetooth, no aplica, Red Ethernet industrial (Industrial Ethernet),Incorrecto.  Red Wi-Fi doméstica no es la mejor opción para resolver el caso descrito. Revisa las características de  red wi-fi doméstica y su aplicación práctica.,Incorrecto. Red Bluetooth no es la mejor opción para resolver el caso descrito. Revisa las características de red bluetooth y su aplicación práctica.,Incorrecto.  no aplica no es la mejor opción para resolver el caso descrito. Revisa las características de  no aplica y su aplicación práctica.,"Correcto.  Red Ethernet industrial (Industrial Ethernet) es la elección adecuada porque cumple con las necesidades mecánicas del escenario presentado, garantizando un funcionamiento eficiente y seguro.",Activo, no aplica,AR3C2,TEM10
PREG089, Caso: Se asigna a los estudiantes configurar una red PROFINET para la integración de sensores y actuadores en una planta automatizada. ¿Qué ventaja principal ofrece PROFINET en esta aplicación?,Uso exclusivo para redes domésticas, Baja velocidad de transferencia, no aplica, Comunicación determinística y en tiempo real,Incorrecto. Uso exclusivo para redes domésticas no es la mejor opción para resolver el caso descrito. Revisa las características de uso exclusivo para redes domésticas y su aplicación práctica.,Incorrecto.  Baja velocidad de transferencia no es la mejor opción para resolver el caso descrito. Revisa las características de  baja velocidad de transferencia y su aplicación práctica.,Incorrecto.  no aplica no es la mejor opción para resolver el caso descrito. Revisa las características de  no aplica y su aplicación práctica.,"Correcto.  Comunicación determinística y en tiempo real es la elección adecuada porque cumple con las necesidades mecánicas del escenario presentado, garantizando un funcionamiento eficiente y seguro.",Activo, no aplica,AR3C2,TEM10
PREG090, Caso: Se detecta interferencia en la comunicación de una red industrial que utiliza cables de cobre en una planta con muchas máquinas eléctricas. ¿Qué solución es la más adecuada para mejorar la calidad de la señal?,  Usar cables más largos de cobre, Aumentar la velocidad de la red, no aplica,  Cambiar a cables de fibra óptica,Incorrecto.   Usar cables más largos de cobre no es la mejor opción para resolver el caso descrito. Revisa las características de   usar cables más largos de cobre y su aplicación práctica.,Incorrecto.  Aumentar la velocidad de la red no es la mejor opción para resolver el caso descrito. Revisa las características de  aumentar la velocidad de la red y su aplicación práctica.,Incorrecto.  no aplica no es la mejor opción para resolver el caso descrito. Revisa las características de  no aplica y su aplicación práctica.,"Correcto.   Cambiar a cables de fibra óptica es la elección adecuada porque cumple con las necesidades mecánicas del escenario presentado, garantizando un funcionamiento eficiente y seguro.",Activo, no aplica,AR3C2,TEM10
PREG091, Caso: En la implementación de una red industrial se debe garantizar la seguridad para evitar accesos no autorizados. ¿Qué medida es la más efectiva para proteger la red?,Dejar la red abierta para facilitar acceso rápido,  Conectar todos los dispositivos sin control de acceso, no aplica,Utilizar firewalls industriales y segmentación de red,Incorrecto. Dejar la red abierta para facilitar acceso rápido no es la mejor opción para resolver el caso descrito. Revisa las características de dejar la red abierta para facilitar acceso rápido y su aplicación práctica.,Incorrecto.   Conectar todos los dispositivos sin control de acceso no es la mejor opción para resolver el caso descrito. Revisa las características de   conectar todos los dispositivos sin control de acceso y su aplicación práctica.,Incorrecto.  no aplica no es la mejor opción para resolver el caso descrito. Revisa las características de  no aplica y su aplicación práctica.,"Correcto. Utilizar firewalls industriales y segmentación de red es la elección adecuada porque cumple con las necesidades mecánicas del escenario presentado, garantizando un funcionamiento eficiente y seguro.",Activo, no aplica,AR3C2,TEM10
PREG092, Caso: Para monitorear remotamente una planta industrial se debe elegir un protocolo que permita comunicación a larga distancia y con baja latencia. ¿Qué protocolo es más adecuado?,USB 2.0, I2C, no aplica,Modbus TCP/IP,Incorrecto. USB 2.0 no es la mejor opción para resolver el caso descrito. Revisa las características de usb 2.0 y su aplicación práctica.,Incorrecto.  I2C no es la mejor opción para resolver el caso descrito. Revisa las características de  i2c y su aplicación práctica.,Incorrecto.  no aplica no es la mejor opción para resolver el caso descrito. Revisa las características de  no aplica y su aplicación práctica.,"Correcto. Modbus TCP/IP es la elección adecuada porque cumple con las necesidades mecánicas del escenario presentado, garantizando un funcionamiento eficiente y seguro.",Activo, no aplica,AR3C2,TEM10
PREG093, Caso: Los estudiantes deben integrar una red industrial con dispositivos heterogéneos de diferentes fabricantes. ¿Qué estándar o protocolo facilita esta interoperabilidad?, VGA, HTTP básico sin seguridad, no aplica,OPC UA (Open Platform Communications Unified Architecture),Incorrecto.  VGA no es la mejor opción para resolver el caso descrito. Revisa las características de  vga y su aplicación práctica.,Incorrecto.  HTTP básico sin seguridad no es la mejor opción para resolver el caso descrito. Revisa las características de  http básico sin seguridad y su aplicación práctica.,Incorrecto.  no aplica no es la mejor opción para resolver el caso descrito. Revisa las características de  no aplica y su aplicación práctica.,"Correcto. OPC UA (Open Platform Communications Unified Architecture) es la elección adecuada porque cumple con las necesidades mecánicas del escenario presentado, garantizando un funcionamiento eficiente y seguro.",Activo, no aplica,AR3C2,TEM10
PREG094, Caso: Una red industrial debe poder configurarse y diagnosticar fallas fácilmente desde una estación central. ¿Qué característica debe tener la red para facilitar esto?,Comunicación solo local sin registro de eventos,Uso de cables sin identificación ni etiquetado, no aplica, Soporte para gestión remota y diagnóstico en línea,Incorrecto. Comunicación solo local sin registro de eventos no es la mejor opción para resolver el caso descrito. Revisa las características de comunicación solo local sin registro de eventos y su aplicación práctica.,Incorrecto. Uso de cables sin identificación ni etiquetado no es la mejor opción para resolver el caso descrito. Revisa las características de uso de cables sin identificación ni etiquetado y su aplicación práctica.,Incorrecto.  no aplica no es la mejor opción para resolver el caso descrito. Revisa las características de  no aplica y su aplicación práctica.,"Correcto.  Soporte para gestión remota y diagnóstico en línea es la elección adecuada porque cumple con las necesidades mecánicas del escenario presentado, garantizando un funcionamiento eficiente y seguro.",Activo, no aplica,AR3C2,TEM10
PREG095, Caso: Para controlar un proceso de manufactura se requiere que la red responda con tiempos menores a 1 ms. ¿Qué característica debe tener la red industrial?,Comunicación asíncrona sin garantía de tiempo,Uso de protocolos analógicos, no aplica, Comunicación en tiempo real (determinística),Incorrecto. Comunicación asíncrona sin garantía de tiempo no es la mejor opción para resolver el caso descrito. Revisa las características de comunicación asíncrona sin garantía de tiempo y su aplicación práctica.,Incorrecto. Uso de protocolos analógicos no es la mejor opción para resolver el caso descrito. Revisa las características de uso de protocolos analógicos y su aplicación práctica.,Incorrecto.  no aplica no es la mejor opción para resolver el caso descrito. Revisa las características de  no aplica y su aplicación práctica.,"Correcto.  Comunicación en tiempo real (determinística) es la elección adecuada porque cumple con las necesidades mecánicas del escenario presentado, garantizando un funcionamiento eficiente y seguro.",Activo, no aplica,AR3C2,TEM10
PREG096, Caso: En una planta se está reemplazando la red antigua basada en Modbus RTU por una solución más moderna. ¿Qué beneficio ofrece el cambio a Modbus TCP/IP?,Mayor consumo energético en los dispositivos, Mayor complejidad sin beneficios claros, no aplica, Uso de infraestructura Ethernet y mayor velocidad,Incorrecto. Mayor consumo energético en los dispositivos no es la mejor opción para resolver el caso descrito. Revisa las características de mayor consumo energético en los dispositivos y su aplicación práctica.,Incorrecto.  Mayor complejidad sin beneficios claros no es la mejor opción para resolver el caso descrito. Revisa las características de  mayor complejidad sin beneficios claros y su aplicación práctica.,Incorrecto.  no aplica no es la mejor opción para resolver el caso descrito. Revisa las características de  no aplica y su aplicación práctica.,"Correcto.  Uso de infraestructura Ethernet y mayor velocidad es la elección adecuada porque cumple con las necesidades mecánicas del escenario presentado, garantizando un funcionamiento eficiente y seguro.",Activo, no aplica,AR3C2,TEM10
PREG097, Caso: El equipo debe asegurar la confiabilidad de la red ante fallos en un nodo crítico. ¿Qué estrategia se recomienda?, Utilizar un solo cable para todos los dispositivos,Apagar dispositivos para evitar sobrecarga, no aplica, Implementar redundancia y caminos alternos en la red,Incorrecto.  Utilizar un solo cable para todos los dispositivos no es la mejor opción para resolver el caso descrito. Revisa las características de  utilizar un solo cable para todos los dispositivos y su aplicación práctica.,Incorrecto. Apagar dispositivos para evitar sobrecarga no es la mejor opción para resolver el caso descrito. Revisa las características de apagar dispositivos para evitar sobrecarga y su aplicación práctica.,Incorrecto.  no aplica no es la mejor opción para resolver el caso descrito. Revisa las características de  no aplica y su aplicación práctica.,"Correcto.  Implementar redundancia y caminos alternos en la red es la elección adecuada porque cumple con las necesidades mecánicas del escenario presentado, garantizando un funcionamiento eficiente y seguro.",Activo, no aplica,AR3C2,TEM10
PREG098, Caso: En un sistema mecatrónico se debe automatizar el llenado de botellas usando sensores de nivel y actuadores para válvulas. ¿Qué tipo de control es el más adecuado para garantizar precisión y rapidez?, Control manual basado en observación visual,  Control en lazo abierto sin sensores, no aplica,Control en lazo cerrado con realimentación de sensores,Incorrecto.  Control manual basado en observación visual no es la mejor opción para resolver el caso descrito. Revisa las características de  control manual basado en observación visual y su aplicación práctica.,Incorrecto.   Control en lazo abierto sin sensores no es la mejor opción para resolver el caso descrito. Revisa las características de   control en lazo abierto sin sensores y su aplicación práctica.,Incorrecto.  no aplica no es la mejor opción para resolver el caso descrito. Revisa las características de  no aplica y su aplicación práctica.,"Correcto. Control en lazo cerrado con realimentación de sensores es la elección adecuada porque cumple con las necesidades mecánicas del escenario presentado, garantizando un funcionamiento eficiente y seguro.",Activo, no aplica,AR3C2,TEM11
PREG099, Caso: Se debe diseñar un sistema de control para regular la velocidad de un motor eléctrico en una máquina automatizada. ¿Qué dispositivo es fundamental para implementar un control efectivo?, Interruptor manual, Resistencia variable (potenciómetro), no aplica, Variador de frecuencia (VFD),Incorrecto.  Interruptor manual no es la mejor opción para resolver el caso descrito. Revisa las características de  interruptor manual y su aplicación práctica.,Incorrecto.  Resistencia variable (potenciómetro) no es la mejor opción para resolver el caso descrito. Revisa las características de  resistencia variable (potenciómetro) y su aplicación práctica.,Incorrecto.  no aplica no es la mejor opción para resolver el caso descrito. Revisa las características de  no aplica y su aplicación práctica.,"Correcto.  Variador de frecuencia (VFD) es la elección adecuada porque cumple con las necesidades mecánicas del escenario presentado, garantizando un funcionamiento eficiente y seguro.",Activo, no aplica,AR3C2,TEM11
PREG100, Caso: En una línea de producción se usan controladores lógicos programables (PLC) para secuenciar operaciones de varios dispositivos. ¿Cuál es la principal ventaja del uso de PLC en la automatización industrial?, Control exclusivo mediante relés electromecánicos, Limitado a control manual con botones y palancas, no aplica, Programabilidad y flexibilidad para cambiar procesos,Incorrecto.  Control exclusivo mediante relés electromecánicos no es la mejor opción para resolver el caso descrito. Revisa las características de  control exclusivo mediante relés electromecánicos y su aplicación práctica.,Incorrecto.  Limitado a control manual con botones y palancas no es la mejor opción para resolver el caso descrito. Revisa las características de  limitado a control manual con botones y palancas y su aplicación práctica.,Incorrecto.  no aplica no es la mejor opción para resolver el caso descrito. Revisa las características de  no aplica y su aplicación práctica.,"Correcto.  Programabilidad y flexibilidad para cambiar procesos es la elección adecuada porque cumple con las necesidades mecánicas del escenario presentado, garantizando un funcionamiento eficiente y seguro.",Activo, no aplica,AR3C2,TEM11
PREG101, Caso: Para un proceso industrial crítico se requiere que el sistema de control tenga alta confiabilidad y capacidad de diagnóstico. ¿Qué característica debe tener el sistema de control?,Sistema sin capacidad de monitoreo, Control exclusivamente analógico, no aplica, Capacidad de autodiagnóstico y redundancia,Incorrecto. Sistema sin capacidad de monitoreo no es la mejor opción para resolver el caso descrito. Revisa las características de sistema sin capacidad de monitoreo y su aplicación práctica.,Incorrecto.  Control exclusivamente analógico no es la mejor opción para resolver el caso descrito. Revisa las características de  control exclusivamente analógico y su aplicación práctica.,Incorrecto.  no aplica no es la mejor opción para resolver el caso descrito. Revisa las características de  no aplica y su aplicación práctica.,"Correcto.  Capacidad de autodiagnóstico y redundancia es la elección adecuada porque cumple con las necesidades mecánicas del escenario presentado, garantizando un funcionamiento eficiente y seguro.",Activo, no aplica,AR3C2,TEM11
