ID_Pregunta,Pregunta,Opcion_A,Opcion_B,Opcion_C,Opcion_Correcta,Comentario_A,Comentario_B,Comentario_C,Comentario_Correcta,Estado,ID_Video,ID_Area,ID_Tema
PREG217, Caso: En un entorno industrial ruidoso se requiere comunicación sin cables. ¿Qué tecnología inalámbrica industrial puede emplearse con confiabilidad?, Wi-Fi casero de 2.4 GHz, Infrarrojo, no aplica, WirelessHART,Incorrecto.  Wi-Fi casero de 2.4 GHz no es la mejor opción para resolver el caso descrito. Revisa las características de  wi-fi casero de 2.4 ghz y su aplicación práctica.,Incorrecto.  Infrarrojo no es la mejor opción para resolver el caso descrito. Revisa las características de  infrarrojo y su aplicación práctica.,Incorrecto.  no aplica no es la mejor opción para resolver el caso descrito. Revisa las características de  no aplica y su aplicación práctica.,"Correcto.  WirelessHART es la elección adecuada porque cumple con las necesidades mecánicas del escenario presentado, garantizando un funcionamiento eficiente y seguro.",Activo, no aplica,AR3C2,TEM10
PREG218, Caso: Un sistema requiere ajustar automáticamente el nivel de presión de un tanque según la demanda. ¿Qué tipo de control debe implementarse?, Control fijo sin cambios, Ajuste manual por operador, no aplica, Control en lazo cerrado PID,Incorrecto.  Control fijo sin cambios no es la mejor opción para resolver el caso descrito. Revisa las características de  control fijo sin cambios y su aplicación práctica.,Incorrecto.  Ajuste manual por operador no es la mejor opción para resolver el caso descrito. Revisa las características de  ajuste manual por operador y su aplicación práctica.,Incorrecto.  no aplica no es la mejor opción para resolver el caso descrito. Revisa las características de  no aplica y su aplicación práctica.,"Correcto.  Control en lazo cerrado PID es la elección adecuada porque cumple con las necesidades mecánicas del escenario presentado, garantizando un funcionamiento eficiente y seguro.",Activo, no aplica,AR3C2,TEM11
PREG219, Caso: Para evitar errores en una máquina automática se desea implementar un sistema de paro de emergencia. ¿Qué elemento debe incluirse?, Diodo de señal, Transformador de aislamiento, no aplica," Botón pulsador tipo ""parada de emergencia""",Incorrecto.  Diodo de señal no es la mejor opción para resolver el caso descrito. Revisa las características de  diodo de señal y su aplicación práctica.,Incorrecto.  Transformador de aislamiento no es la mejor opción para resolver el caso descrito. Revisa las características de  transformador de aislamiento y su aplicación práctica.,Incorrecto.  no aplica no es la mejor opción para resolver el caso descrito. Revisa las características de  no aplica y su aplicación práctica.,"Correcto.  Botón pulsador tipo ""parada de emergencia"" es la elección adecuada porque cumple con las necesidades mecánicas del escenario presentado, garantizando un funcionamiento eficiente y seguro.",Activo, no aplica,AR3C2,TEM11
PREG220, Caso: Un proceso industrial requiere que se ejecute una acción exacta cada vez que ocurre un evento externo. ¿Qué técnica de programación es más adecuada?, Delay prolongado, Lectura manual, no aplica, Uso de interrupciones,Incorrecto.  Delay prolongado no es la mejor opción para resolver el caso descrito. Revisa las características de  delay prolongado y su aplicación práctica.,Incorrecto.  Lectura manual no es la mejor opción para resolver el caso descrito. Revisa las características de  lectura manual y su aplicación práctica.,Incorrecto.  no aplica no es la mejor opción para resolver el caso descrito. Revisa las características de  no aplica y su aplicación práctica.,"Correcto.  Uso de interrupciones es la elección adecuada porque cumple con las necesidades mecánicas del escenario presentado, garantizando un funcionamiento eficiente y seguro.",Activo, no aplica,AR3C2,TEM11
PREG221, Caso: En una planta embotelladora se requiere contar botellas con precisión. ¿Qué tipo de sensor y control pueden implementarse?, Sensor térmico y control manual, Sensor ultrasónico y visualización, no aplica, Sensor óptico y control automático en lazo cerrado,Incorrecto.  Sensor térmico y control manual no es la mejor opción para resolver el caso descrito. Revisa las características de  sensor térmico y control manual y su aplicación práctica.,Incorrecto.  Sensor ultrasónico y visualización no es la mejor opción para resolver el caso descrito. Revisa las características de  sensor ultrasónico y visualización y su aplicación práctica.,Incorrecto.  no aplica no es la mejor opción para resolver el caso descrito. Revisa las características de  no aplica y su aplicación práctica.,"Correcto.  Sensor óptico y control automático en lazo cerrado es la elección adecuada porque cumple con las necesidades mecánicas del escenario presentado, garantizando un funcionamiento eficiente y seguro.",Activo, no aplica,AR3C2,TEM11
PREG222, Caso: Un controlador industrial debe mantener estable la temperatura de un horno. ¿Qué parámetro es fundamental para configurar el sistema de control?, Potencia de la red eléctrica, Color del termómetro, no aplica, Ganancia proporcional del controlador,Incorrecto.  Potencia de la red eléctrica no es la mejor opción para resolver el caso descrito. Revisa las características de  potencia de la red eléctrica y su aplicación práctica.,Incorrecto.  Color del termómetro no es la mejor opción para resolver el caso descrito. Revisa las características de  color del termómetro y su aplicación práctica.,Incorrecto.  no aplica no es la mejor opción para resolver el caso descrito. Revisa las características de  no aplica y su aplicación práctica.,"Correcto.  Ganancia proporcional del controlador es la elección adecuada porque cumple con las necesidades mecánicas del escenario presentado, garantizando un funcionamiento eficiente y seguro.",Activo, no aplica,AR3C2,TEM11
PREG223, Caso: En un sistema automatizado se desea evitar el uso de sensores adicionales mediante modelado del proceso. ¿Qué técnica puede aplicarse?, Automatización por relés, Detección óptica redundante, no aplica, Control predictivo basado en modelo,Incorrecto.  Automatización por relés no es la mejor opción para resolver el caso descrito. Revisa las características de  automatización por relés y su aplicación práctica.,Incorrecto.  Detección óptica redundante no es la mejor opción para resolver el caso descrito. Revisa las características de  detección óptica redundante y su aplicación práctica.,Incorrecto.  no aplica no es la mejor opción para resolver el caso descrito. Revisa las características de  no aplica y su aplicación práctica.,"Correcto.  Control predictivo basado en modelo es la elección adecuada porque cumple con las necesidades mecánicas del escenario presentado, garantizando un funcionamiento eficiente y seguro.",Activo, no aplica,AR3C2,TEM11
PREG224, Caso: Para garantizar el correcto funcionamiento de los actuadores se decide incluir sensores que verifiquen su posición. ¿Qué técnica se está aplicando?, Control manual de los actuadores, Activación simultánea sin control, no aplica, Control con realimentación,Incorrecto.  Control manual de los actuadores no es la mejor opción para resolver el caso descrito. Revisa las características de  control manual de los actuadores y su aplicación práctica.,Incorrecto.  Activación simultánea sin control no es la mejor opción para resolver el caso descrito. Revisa las características de  activación simultánea sin control y su aplicación práctica.,Incorrecto.  no aplica no es la mejor opción para resolver el caso descrito. Revisa las características de  no aplica y su aplicación práctica.,"Correcto.  Control con realimentación es la elección adecuada porque cumple con las necesidades mecánicas del escenario presentado, garantizando un funcionamiento eficiente y seguro.",Activo, no aplica,AR3C2,TEM11
PREG225, Caso: Se desea comparar la respuesta de dos sistemas de control distintos bajo las mismas condiciones. ¿Qué herramienta es adecuada para ello?, Cable de prueba simple, Simulador de calor, no aplica, Simulación comparativa en entorno SCADA o MATLAB,Incorrecto.  Cable de prueba simple no es la mejor opción para resolver el caso descrito. Revisa las características de  cable de prueba simple y su aplicación práctica.,Incorrecto.  Simulador de calor no es la mejor opción para resolver el caso descrito. Revisa las características de  simulador de calor y su aplicación práctica.,Incorrecto.  no aplica no es la mejor opción para resolver el caso descrito. Revisa las características de  no aplica y su aplicación práctica.,"Correcto.  Simulación comparativa en entorno SCADA o MATLAB es la elección adecuada porque cumple con las necesidades mecánicas del escenario presentado, garantizando un funcionamiento eficiente y seguro.",Activo, no aplica,AR3C2,TEM11
PREG226, Caso: Un sistema requiere medir continuamente el flujo de un líquido y ajustar el actuador en tiempo real. ¿Qué configuración es más eficiente?, Medición cada 30 minutos, Control manual intermitente, no aplica, Sensor de flujo + controlador PID + actuador proporcional,Incorrecto.  Medición cada 30 minutos no es la mejor opción para resolver el caso descrito. Revisa las características de  medición cada 30 minutos y su aplicación práctica.,Incorrecto.  Control manual intermitente no es la mejor opción para resolver el caso descrito. Revisa las características de  control manual intermitente y su aplicación práctica.,Incorrecto.  no aplica no es la mejor opción para resolver el caso descrito. Revisa las características de  no aplica y su aplicación práctica.,"Correcto.  Sensor de flujo + controlador PID + actuador proporcional es la elección adecuada porque cumple con las necesidades mecánicas del escenario presentado, garantizando un funcionamiento eficiente y seguro.",Activo, no aplica,AR3C2,TEM11
PREG108,¿Para que son fundamentales los actuadores?,agilizar,profundizar,movilizar,automatizar,Incorrecto. agilizar no es la mejor opción para resolver el caso descrito. Revisa las características de agilizar y su aplicación práctica.,Incorrecto. profundizar no es la mejor opción para resolver el caso descrito. Revisa las características de profundizar y su aplicación práctica.,Incorrecto. movilizar no es la mejor opción para resolver el caso descrito. Revisa las características de movilizar y su aplicación práctica.,"Correcto. automatizar es la elección adecuada porque cumple con las necesidades mecánicas del escenario presentado, garantizando un funcionamiento eficiente y seguro.",Activo,VID1,AR1C2,No aplica
PREG109,¿Cuáles son los tipos más comunes de actuadores?,Solares ó térmicos y mecánicos,Digitales ó analógicos y ópticos,Magnéticos ó acústicos y térmicos,Eléctricos ó hidráulicos y neumáticos,Incorrecto. Solares ó térmicos y mecánicos no es la mejor opción para resolver el caso descrito. Revisa las características de solares ó térmicos y mecánicos y su aplicación práctica.,Incorrecto. Digitales ó analógicos y ópticos no es la mejor opción para resolver el caso descrito. Revisa las características de digitales ó analógicos y ópticos y su aplicación práctica.,Incorrecto. Magnéticos ó acústicos y térmicos no es la mejor opción para resolver el caso descrito. Revisa las características de magnéticos ó acústicos y térmicos y su aplicación práctica.,"Correcto. Eléctricos ó hidráulicos y neumáticos es la elección adecuada porque cumple con las necesidades mecánicas del escenario presentado, garantizando un funcionamiento eficiente y seguro.",Activo,VID1,AR1C2,No aplica
PREG110,¿Cuál es el tipo de energía que convierten los actuadores electricos?,energía cinética,energía térmica,energía nucelar,energía eléctrica,Incorrecto. energía cinética no es la mejor opción para resolver el caso descrito. Revisa las características de energía cinética y su aplicación práctica.,Incorrecto. energía térmica no es la mejor opción para resolver el caso descrito. Revisa las características de energía térmica y su aplicación práctica.,Incorrecto. energía nucelar no es la mejor opción para resolver el caso descrito. Revisa las características de energía nucelar y su aplicación práctica.,"Correcto. energía eléctrica es la elección adecuada porque cumple con las necesidades mecánicas del escenario presentado, garantizando un funcionamiento eficiente y seguro.",Activo,VID1,AR1C2,No aplica
PREG111,¿Cómo es que funcionan los actuadores neumáticos?,Con energía solar,Con electricidad,Con vapor de agua,Con aire comprimido,Incorrecto. Con energía solar no es la mejor opción para resolver el caso descrito. Revisa las características de con energía solar y su aplicación práctica.,Incorrecto. Con electricidad no es la mejor opción para resolver el caso descrito. Revisa las características de con electricidad y su aplicación práctica.,Incorrecto. Con vapor de agua no es la mejor opción para resolver el caso descrito. Revisa las características de con vapor de agua y su aplicación práctica.,"Correcto. Con aire comprimido es la elección adecuada porque cumple con las necesidades mecánicas del escenario presentado, garantizando un funcionamiento eficiente y seguro.",Activo,VID1,AR1C2,No aplica
PREG112,¿En qué tipo de aplicaciones se suelen usar los actuadores hidráulicos?,En relojes inteligentes,En sistemas de iluminación,En juguetes electrónicos,En grúas o equipos de construcción,Incorrecto. En relojes inteligentes no es la mejor opción para resolver el caso descrito. Revisa las características de en relojes inteligentes y su aplicación práctica.,Incorrecto. En sistemas de iluminación no es la mejor opción para resolver el caso descrito. Revisa las características de en sistemas de iluminación y su aplicación práctica.,Incorrecto. En juguetes electrónicos no es la mejor opción para resolver el caso descrito. Revisa las características de en juguetes electrónicos y su aplicación práctica.,"Correcto. En grúas o equipos de construcción es la elección adecuada porque cumple con las necesidades mecánicas del escenario presentado, garantizando un funcionamiento eficiente y seguro.",Activo,VID1,AR1C2,No aplica
PREG113,¿Para qué sirve la instrumentación en sistemas mecatrónicos?,Para decorar componentes eléctricos,Para pintar piezas mecánicas,Para limpiar sensores automáticamente,Para medir y controlar variables físicas y mecánicas,Incorrecto. Para decorar componentes eléctricos no es la mejor opción para resolver el caso descrito. Revisa las características de para decorar componentes eléctricos y su aplicación práctica.,Incorrecto. Para pintar piezas mecánicas no es la mejor opción para resolver el caso descrito. Revisa las características de para pintar piezas mecánicas y su aplicación práctica.,Incorrecto. Para limpiar sensores automáticamente no es la mejor opción para resolver el caso descrito. Revisa las características de para limpiar sensores automáticamente y su aplicación práctica.,"Correcto. Para medir y controlar variables físicas y mecánicas es la elección adecuada porque cumple con las necesidades mecánicas del escenario presentado, garantizando un funcionamiento eficiente y seguro.",Activo,VID3,AR1C2,No aplica
PREG114,¿Cuáles son los tres elementos principales de la instrumentación en sistemas mecatrónicos?,Cables y conectores o motores,Pantallas y luces o alarmas,Interruptores o fusibles y transformadores,Sensores y acondicionamiento de señales o adquisición de datos,Incorrecto. Cables y conectores o motores no es la mejor opción para resolver el caso descrito. Revisa las características de cables y conectores o motores y su aplicación práctica.,Incorrecto. Pantallas y luces o alarmas no es la mejor opción para resolver el caso descrito. Revisa las características de pantallas y luces o alarmas y su aplicación práctica.,Incorrecto. Interruptores o fusibles y transformadores no es la mejor opción para resolver el caso descrito. Revisa las características de interruptores o fusibles y transformadores y su aplicación práctica.,"Correcto. Sensores y acondicionamiento de señales o adquisición de datos es la elección adecuada porque cumple con las necesidades mecánicas del escenario presentado, garantizando un funcionamiento eficiente y seguro.",Activo,VID3,AR1C2,No aplica
PREG115,¿Qué función cumplen los sensores en un sistema mecatrónico?,Enfriar los componentes electrónicos,Generar energía eléctrica,Pintar las superficies mecánicas,Medir variables como temperatura o posición y presión,Incorrecto. Enfriar los componentes electrónicos no es la mejor opción para resolver el caso descrito. Revisa las características de enfriar los componentes electrónicos y su aplicación práctica.,Incorrecto. Generar energía eléctrica no es la mejor opción para resolver el caso descrito. Revisa las características de generar energía eléctrica y su aplicación práctica.,Incorrecto. Pintar las superficies mecánicas no es la mejor opción para resolver el caso descrito. Revisa las características de pintar las superficies mecánicas y su aplicación práctica.,"Correcto. Medir variables como temperatura o posición y presión es la elección adecuada porque cumple con las necesidades mecánicas del escenario presentado, garantizando un funcionamiento eficiente y seguro.",Activo,VID3,AR1C2,No aplica
PREG116,¿Para qué sirve el acondicionamiento de la señal en instrumentación?,Para convertir señales en imágenes,Para almacenar datos directamente,Para detectar colores en el sistema,Para adaptar y amplificar o filtrar señales captadas por sensores,Incorrecto. Para convertir señales en imágenes no es la mejor opción para resolver el caso descrito. Revisa las características de para convertir señales en imágenes y su aplicación práctica.,Incorrecto. Para almacenar datos directamente no es la mejor opción para resolver el caso descrito. Revisa las características de para almacenar datos directamente y su aplicación práctica.,Incorrecto. Para detectar colores en el sistema no es la mejor opción para resolver el caso descrito. Revisa las características de para detectar colores en el sistema y su aplicación práctica.,"Correcto. Para adaptar y amplificar o filtrar señales captadas por sensores es la elección adecuada porque cumple con las necesidades mecánicas del escenario presentado, garantizando un funcionamiento eficiente y seguro.",Activo,VID3,AR1C2,No aplica
PREG117,¿Por qué es importante la instrumentación en la mecatrónica?,Porque evita el uso de sensores totalmente,Porque disminuye el uso de energía solar,Porque permite reducir el peso de los robots,Porque integra sensores y acondicionamiento o adquisición en una sola plataforma,Incorrecto. Porque evita el uso de sensores totalmente no es la mejor opción para resolver el caso descrito. Revisa las características de porque evita el uso de sensores totalmente y su aplicación práctica.,Incorrecto. Porque disminuye el uso de energía solar no es la mejor opción para resolver el caso descrito. Revisa las características de porque disminuye el uso de energía solar y su aplicación práctica.,Incorrecto. Porque permite reducir el peso de los robots no es la mejor opción para resolver el caso descrito. Revisa las características de porque permite reducir el peso de los robots y su aplicación práctica.,"Correcto. Porque integra sensores y acondicionamiento o adquisición en una sola plataforma es la elección adecuada porque cumple con las necesidades mecánicas del escenario presentado, garantizando un funcionamiento eficiente y seguro.",Activo,VID3,AR1C2,No aplica
PREG118,¿En qué lenguajes se suelen programar los sistemas electrónicos?,Excel o Word y PowerPoint,SQL o Ruby y Java,HTML o CSS y JavaScript,Ensamblador o C y C++ o Python,Incorrecto. Excel o Word y PowerPoint no es la mejor opción para resolver el caso descrito. Revisa las características de excel o word y powerpoint y su aplicación práctica.,Incorrecto. SQL o Ruby y Java no es la mejor opción para resolver el caso descrito. Revisa las características de sql o ruby y java y su aplicación práctica.,Incorrecto. HTML o CSS y JavaScript no es la mejor opción para resolver el caso descrito. Revisa las características de html o css y javascript y su aplicación práctica.,"Correcto. Ensamblador o C y C++ o Python es la elección adecuada porque cumple con las necesidades mecánicas del escenario presentado, garantizando un funcionamiento eficiente y seguro.",Activo,VID4,AR2C2,No aplica
PREG119,¿Qué hacen las estructuras de control en la programación de sistemas electrónicos?,Cambian automáticamente el idioma del sistema,Controlan la batería del microcontrolador,Establecen la hora y fecha,Permiten repetir acciones o tomar decisiones según las entradas,Incorrecto. Cambian automáticamente el idioma del sistema no es la mejor opción para resolver el caso descrito. Revisa las características de cambian automáticamente el idioma del sistema y su aplicación práctica.,Incorrecto. Controlan la batería del microcontrolador no es la mejor opción para resolver el caso descrito. Revisa las características de controlan la batería del microcontrolador y su aplicación práctica.,Incorrecto. Establecen la hora y fecha no es la mejor opción para resolver el caso descrito. Revisa las características de establecen la hora y fecha y su aplicación práctica.,"Correcto. Permiten repetir acciones o tomar decisiones según las entradas es la elección adecuada porque cumple con las necesidades mecánicas del escenario presentado, garantizando un funcionamiento eficiente y seguro.",Activo,VID4,AR2C2,No aplica
PREG120,¿Qué son los sistemas embebidos?,Sensores usados únicamente en robots,Equipos de sonido inalámbricos,Computadoras para videojuegos,Dispositivos programados para tareas específicas como controlar temperatura,Incorrecto. Sensores usados únicamente en robots no es la mejor opción para resolver el caso descrito. Revisa las características de sensores usados únicamente en robots y su aplicación práctica.,Incorrecto. Equipos de sonido inalámbricos no es la mejor opción para resolver el caso descrito. Revisa las características de equipos de sonido inalámbricos y su aplicación práctica.,Incorrecto. Computadoras para videojuegos no es la mejor opción para resolver el caso descrito. Revisa las características de computadoras para videojuegos y su aplicación práctica.,"Correcto. Dispositivos programados para tareas específicas como controlar temperatura es la elección adecuada porque cumple con las necesidades mecánicas del escenario presentado, garantizando un funcionamiento eficiente y seguro.",Activo,VID4,AR2C2,No aplica
PREG121,¿Qué aplicación es un ejemplo de sistema embebido?,Un videojuego en línea,El diseño de una página web,Una red social en el celular,El control de temperatura en un electrodoméstico,Incorrecto. Un videojuego en línea no es la mejor opción para resolver el caso descrito. Revisa las características de un videojuego en línea y su aplicación práctica.,Incorrecto. El diseño de una página web no es la mejor opción para resolver el caso descrito. Revisa las características de el diseño de una página web y su aplicación práctica.,Incorrecto. Una red social en el celular no es la mejor opción para resolver el caso descrito. Revisa las características de una red social en el celular y su aplicación práctica.,"Correcto. El control de temperatura en un electrodoméstico es la elección adecuada porque cumple con las necesidades mecánicas del escenario presentado, garantizando un funcionamiento eficiente y seguro.",Activo,VID4,AR2C2,No aplica
PREG122,¿Cuál es uno de los pasos para programar un sistema electrónico?,Pintar el microcontrolador,Desinstalar el código base,Limpiar las señales digitales,Escribir para luego compilar y cargar el código en el microcontrolador,Incorrecto. Pintar el microcontrolador no es la mejor opción para resolver el caso descrito. Revisa las características de pintar el microcontrolador y su aplicación práctica.,Incorrecto. Desinstalar el código base no es la mejor opción para resolver el caso descrito. Revisa las características de desinstalar el código base y su aplicación práctica.,Incorrecto. Limpiar las señales digitales no es la mejor opción para resolver el caso descrito. Revisa las características de limpiar las señales digitales y su aplicación práctica.,"Correcto. Escribir para luego compilar y cargar el código en el microcontrolador es la elección adecuada porque cumple con las necesidades mecánicas del escenario presentado, garantizando un funcionamiento eficiente y seguro.",Activo,VID4,AR2C2,No aplica
